"broadleaf tree, broadleaf shrub",Elaeagnus umbellata,autumn olive,,Elaeagnaceae,Eurasia,"Drought-tolerant, sun-loving shrub of grasslands, fields, open woodlands and other disturbed areas.","Shrub to 20 ft tall, with twigs, buds and leaves having silvery to rusty scales.  Leaves alternate, ovate to lanceolate, with entire margins.  Dull green above, and often with brown or whitish scales on the underside, giving a golden-coppery appearance.  Flowers aromatic, pale yellow or white, 1/2"" long, with 4 pointed sepals. Fruits are small, deep red to pink drupes, dotted with brown or silvery scales.  ","By wildlife:  Birds eat the fruits and disperse the seeds.
By humans: Landscape shrub, hedge, windbreak. ","Shrubby plant with alternate, ovate leaves with rusty or whitish scales beneath and a dark red drupe.","Russian olive (E. angustifolia) leaves are narrow-elliptic with silvery scales on both sides., with a yellowish or silvery mealy fruit. ",Invasive exotic and spreading,,broadleaf,alternate,simple,"ovate, lanceolate, elliptic",,,,entire,inconspicuous,,,round,no,scaly,scaly,no,"no thorns, smooth thorns, bumpy thorns",showy / petals present,"white, yellow","radial, bilateral",drupe,red,"smooth, shaggy",yellow,grey-brown
"broadleaf tree, broadleaf shrub",Elaeagnus angustifolia,Russian olive,oleaster,Elaeagnaceae,Eurasia,"Invasive species on poor soils and floodplains, replacing cottonwoods and willows.","Thorny shrub or small tree, 15-25 ft tall, with twigs, buds, and leaves densely covered with silvery to rusty scales. The leaves are alternate, lanceolate, 1 1⁄2–3 1⁄2"" (4–9 cm) long and 3⁄8–1"" (1–2.5 cm ) wide, with entire margins. The aromatic flowers are produced in clusters of one to three, and are 1 cm long with a four-lobed creamy yellow calyx; they appear in early summer and are followed by clusters of fruit, a small olive-like drupe 1/3""– 3/4"" long (1.0–1.7 cm), orange-red and covered in silvery scales. The fruits are edible and sweet, though with a dryish, mealy texture. ","By wildlife:  Birds eat the fruits and disperse the seeds.
By humans: Landscape shrub, hedge.  In Persia, the dried fruit is used to treat joint pain.",Silvery foliage and a silvery or  yellowish drupe fruit.,"Autumn olive (E. umbellata) has wider, ovate leaves with silvery or rusty scales mostly on the underside, and a red drupe.   ","Invasive exotic, and spreading",,broadleaf,alternate,simple,"elliptic, lanceolate",,,,entire,inconspicuous,,,round,no,"scaly, hairy",scaly,no,"no thorns, smooth thorns, bumpy thorns",showy / petals present,yellow,"radial, bilateral",drupe,"silvery, brown, yellow, orange","smooth, peeling/papery",silvery,grey-brown
broadleaf tree,Prunus serotina,black cherry,,Rosaceae,WI,Found throughout WI in upland forests.,"Medium size tree that becomes less shade-tolerant as it grows, causing the trunk to meander upward in search of light.  Bark is distinctive, very dark grey, with somewhat rounded plates curled outward on the edges, giving the tree a scaly appearance.  Leaves alternate, simple, with rounded teeth and paired glands on the petiole.  Lanceolate or elliptic, shiny green above, green underneath with a line of rusty hairs along the midvein near the base.  Leaves have faint cherry odor when crushed.  Flowers white, arranged on a long spike.  Fruits black when ripe and quickly removed by birds.  ",By wildlife: Fruit is eaten by birds and mammals.,Almost black scaly bark on crooked trunk.  Shiny green leaves with rusty hairs along the midvein beneath and glands on the petiole.,"Choke cherry (P. virginiana) is a shrub that could be confused with young black cherry, but choke cherry has dull green ovate leaves, while black cherry has shinier dar green leaves that are lanceolate and usually have a row of rusty hairs on the underside along the midvein.  The bark of choke cherry is smooth has a net-like woven pattern of darker greyish-brown lines on it.",Native,,broadleaf,alternate,simple,"elliptic, lanceolate",,,,finely toothed,"pinnate, inconspicuous",,,round,no,shiny,"dull, hairy",no,no thorns,showy / petals present,white,radial,drupe,black,"scaly, smooth",yellow,grey-brown
broadleaf tree,Celtis occidentalis,northern hackberry,,Celtidaceae,WI,"Found on moist soils, in floodplains and along streams throughout WI. Occasional street tree.","Tree having unique bark with warts and irregular corky ridges.  Leaves, alternate, lanceolate to ovate-cordate, base somewhat cordate, and the tip coming to a long point;   rough textured, with 3-veined at base with toothed margins.  Flowers inconspicuous, green, borne at leaf axils, developing into a small round drupe that becomes black when ripe. ","Wood may be used for furniture, handles, sportinng goods. Not commercially important.",Distinctive warty bark.  Toothed leaves with long extended tip and 3-veined leaf base.,"Elms have asymmetrical leaves, but lack the warty bark, and have samaras, not a black drupe as a fruit.",Native,,broadleaf,alternate,simple,"ovate, lanceolate",,,,"finely toothed, coarsely toothed",3-veined,,,round,yes,"dull, hairy, rough",dull,no,no thorns,inconspicuous / petals absent,,,drupe,"black, green",corky,"yellow, yellow-green",grey-brown
"broadleaf tree, broadleaf shrub",Prunus pensylvanica,pin cherry,"bird cherry, fire cherry, red cherry",Rosaceae,WI,"Shade-intolerant pioneer of forest edges and disturbed sites that colonizes or grows back quickly following fire, logging, or blow-downs. Also along road or powerline corridors.","Shrub or small tree with alternate, simple leaves with rounded teeth and a pair of small glands on the petiole.  Trunk be up to 6½"" diameter at breast height in our area.  Leaves dark green above, and lighter green below sometimes with hairs along the midvein, 1½ – 4½"" long (4–11 cm) long and ⅓ – 1 ⅝"" ( 1–4.5 cm ) wide.  Flowers grouped in 3's to 7's on flat-topped umbels, white, 1/2"" in diameter, with 5 petals.  The fruit is a bright red drupe, about 1/4 - 1/3"" in diameter.  The bark is a shiny reddish brown to gray, peeling in horizontal strips and with conspicuous lenticels. ","By wildlife: Fruit is eaten by birds and mammals.
Little commercial value for humans.  Fruit can be preserved as jellies, and wood may be suitable for fiber or fuel production.","Shrub with reddish bark, alternate leaves with paired glands, clusters of white flowers, and bright red drupes. ","Chokecherry (P. virginiana) is more common, and has dull grey bark with a darker reticulate net pattern.  The flowers are in elongated racemes, not small clusters, and fruits are black when ripe.
Black cherry (P. serotina) is a larger tree, having smooth dark grey bark when young.  The leaves have rusty hairs along the midvein beneath, and the fruits are black.",Native,,broadleaf,alternate,simple,"lanceolate, ovate",,,,finely toothed,"pinnate, reticulate",,,round,no,shiny,"dull, hairy",no,no thorns,showy / petals present,white,radial,drupe,red,"peeling/papery, smooth","orange, yellow, red",grey-brown
broadleaf tree,Tilia americana,basswood,"American linden, American basswood",Malvaceae,WI,Shade-tolerant tree of mesic forests throughout WI.,"Large, shade-tolerant tree with deeply ridged bark, often with sucker shoots arising from the base.  Leaves alternate, simple and cordate, with a 3-veined leaf base.  Leaf base may be quite asymmetrical. The margin is coarsely toothed.  The small fragrant flowers are pale yellowish green, and borne 5-10 in a cluster on a stalk coming off the middle of unique leafy bract, 2-4"" long.  The fruits are hard, dry, round nutlets covered with velvety grey-brown hairs, that are dispersed by wind along with the leafy bract.","By wildlife:  Many insects are attracted to the sweet nectar of the flowers.
By humans:  Basswood honey is prized, and syrup can be made from the sap. The flowers are made into tea, and used to treat colds, flus, migraines, and anxiety-induced indigestion.   The wood is light and not very strong, with little grain.  It can be used for cheap furniture and for solid-body guitars.  It does not readily splinter, so it is used to make seats on swings and saddles.","Broad, heart-shaped leaves with toothed margin and asymmetrical base.  Flowers and fruits attached to unique leafy bract.","Red bud (Cercis canadensis) also has heart shaped (cordate) leaves, but they are entire and the fruit is a legume pod.
Catalpa spp. also have cordate leaves but these are also entire and may be lobed.
Hackberry (Celtis occidentalis) has narrower leaves that are lanceolate with a cordate base and long acuminate tip.  The drupes are not subtended by a leafy bract.",Native,,broadleaf,alternate,simple,cordate,,,,"coarsely toothed, finely toothed",3-veined,,,round,yes,"dull, shiny",dull,no,no thorns,showy / petals present,"green, yellow",radial,drupe,brown,"ridged, fissured","yellow-green, yellow",grey-brown
broadleaf tree,Fagus grandifolia,American beech,beechnut,Fagaceae,WI,"Shade-tolerant, late-successional member of rich, well-drained upland forests in far eastern portion of WI, where it commonly grows together with sugar maple, yellow birch, and Eastern hemlock.","Tree to 100' tall with very smooth, light gray bark, with darker grey chevron patterns where the branches come out.  Branches often held horizontally.  Leaves elliptic to narrowly elliptic, papery in texture, up to 6"" long, with large, widely spaced teeth and straight veins extending to the tips of the teeth.  Underside of leaf with scattered hairs.  Flowers in inconspicuous catkins.  Fruits a small brown to reddish brown ""bur"", opening into 4 thin section when ripe  to reveal 1-3 sharply angled nuts.  Easy to identify in winter by the long-pointed coppery buds covered in overlapping scales, and the light coppery brown leaves that still persist on the tree. ","By wildlife: The occasional large crop of nuts (mast) from American beech provides important food for wildlife, including ruffed grouse, wild turkeys, raccoons, foxes, white-tailed deer, rabbits, squirrels, opossums, pheasants, black bears, and porcupines.
By humans:  The wood is high quality, hard, strong, and durable. It is light in color, made into furniture, flooring, and tool handles. The nuts are edible.  ","Smooth barked tree with shiny green, papery leaves that are coarsely toothed, and twigs with long coppery buds.","American chestnut (Castanea dentata) has thicker, less papery leaves and the bark is furrowed. ",Introduced,,broadleaf,alternate,simple,"ovate, lanceolate, elliptic",,,,coarsely toothed,rectipinnate,,,round,no,shiny,"dull, shiny",no,no thorns,inconspicuous / petals absent,,,leathery capsule,"green, brown",smooth,copper,light grey
broadleaf tree,Castanea dentata,American chestnut,,Fagaceae,U.S.,"Native to the eastern deciduous forests of the U.S., on rich soils.  Planted in WI but rare, but occasionally escapes cultivation.  Rarely reaches large size due to chestnut blight, but somewhat protected from that disease in WI.","Tree to 100' tall with gray bark roughening with age.  Twigs hairless.  Shiny, bright green leaves  5 1/2 –8 "" 14–20 cm) long and 2 1/2 – 4"" (6–10 cm ) wide narrowly obovate to lanceolate, the edges with sharp, long, widely spaced teeth, the tip long pointed.  Small whitish-green male flowers cover most of the 6-9"" long stiff catkins; the female flowers are clustered in 3's near the base of the catkin (nearest the twig), and develop into a distinctive, very spiny ""bur"", opening into a 4-sectioned capsule in fall to expose 1-3 shiny brown triangular nuts inside.  The dried remains of the catkin often stick out between the spiny fruits.","By wildlife:  The nuts are important food for wildlife including deer, turkey and black bear.
By humans:  American chestnut was once a very economically important tree, for its fine wood that were used to make furniture, and the nuts, that were sold commercially especially around the winter holidays. It was also widely planted as a street tree. Chestnut blight, a fungus of Asian origin, decimated the chestnut population within three decades of its accidental introduction to New York in 1904 on Chinese chestnuts.","Long, elliptic leaves with very large, widely spaced, curved and pointed teeth.  The fruit a very bristly capsule, 3"" across.","American beech (Fagus grandifolia) has similar leaves, but they feel papery, and the buds are long-pointed and coppery.  Beech also has very smooth grey bark even on old trees, and a small <1"" thin brown spiny capsule.
Chinese chestnut, occasionally planted, has hairy twigs.","Introduced and rare, but may be spreading in WI.  Large trees of American chestnut are rare throughout its range due to chestnut blight, which reduced the population to a tiny fraction of its former abundance.",,broadleaf,alternate,simple,"elliptic, obovate, lanceolate",,,,"coarsely toothed, spiny",rectipinnate,,,round,no,shiny,"dull, shiny",no,no thorns,inconspicuous / petals absent,,,leathery capsule,"green, brown","ridged, fissured","copper, brown, yellow",grey-brown
broadleaf tree,Aesculus glabra,Ohio buckeye,"American horsechestnut, American buckeye, fetid buckeye",Sapindaceae,U.S.,"Planted as an ornamental in southern WI, but can escape cultivation and may be naturalizing in the south. ","Medium tree to 60' tall with opposite, palmately compound leaves with 5 leaflets.  Flowers greenish-yellow in upright panicles, bilaterally symmetrical, with long stamens that stick out beyond the petals.  Fruit a brown spherical capsule with short spines, 1 1/2 - 2"" in diameter, opening along three sutures to reveal one shiny brown seed inside.  Bark is greyish brown, starting smooth and becoming scaly to irregularly fissured with age.  The pseudoterminal buds are large, ovoid, smooth (not sticky). All parts of the plant are poisonous!  ",By humans:  State tree of Ohio.  Tannic acid extracted from seeds can be used to tan leather.,"The only tree in this state with opposite, palmately compound leaves. ",,Introduced,,broadleaf,opposite,palmately compound,,5-7,"ovate, lanceolate, obovate",,finely toothed,palmate,,,round,,"dull, shiny",dull,no,no thorns,showy / petals present,"green, yellow",bilateral,leathery capsule,"green, brown","smooth, scaly","salmon, red, orange",grey-brown
broadleaf tree,Carpinus caroliniana,American hornbeam,"blue-beech, muscle-wood, ironwood, hornbeam",Betulaceae,WI,"Found throughout WI, especially along river banks, and as an understory tree of moist, rich woods.","Small to medium understory tree to 40' tall with alternate, simple, ovate to elliptic finely doubly-toothed leaves.  The trunk is distinctive, with smooth grey bark and a fluted ""muscly"" appearance, hence the common name ""musclewood"".   Flowers in catkins 3/4""-2 1/3"" long.  Fruits are small nuts in distinctive 1 1/2""-4 1/2"" long dangling clusters of green three-lobed bracts.
",By humans:  The very hard wood of this small statured tree is good for tool handles.,"""Muscly"" trunk with smooth grey bark.  Fruiting structures a unique green catkin made up of lobed bracts.","Hop hornbeam (Ostrya virginiana) has thin, flaky bark, and the fruiting catkins are comprised of small inflated sacs.",Native,,broadleaf,alternate,simple,"ovate, elliptic",,,,"doubly toothed, finely toothed",rectipinnate,,,round,no,dull,dull,no,no thorns,inconspicuous / petals absent,,,nut,"green, brown","smooth, ridged","orange, copper, yellow, red",grey-brown
broadleaf tree,Ostrya virginiana,eastern hop-hornbeam,ironwood,Betulaceae,WI,Found throughout WI in upland forest.,"Small to medium understory tree to 40' tall with alternate, simple, ovate to elliptic finely doubly-toothed leaves.  The bark is light grey and covered in small, thin, rectangular plates that easily flake off when rubbed with the hand.   Flowers in catkins 3/4""-2 1/3"" long.  Fruits are small nuts, in distinctive 1 1/2""-4 1/2"" long dangling clusters of small, ovate, inflated sacs, resembling hops.",By humans: Extremely hard wood used for tool handles.,Rather non-descript understory tree with soft doubly-toothed leaves and a fruiting catkin made up of distinctive sacs that contain a single seed.,,Native,,broadleaf,alternate,simple,"ovate, lanceolate",,,,"doubly toothed, finely toothed",rectipinnate,,,round,no,dull,dull,no,no thorns,inconspicuous / petals absent,,,nut,"green, brown",scaly,"yellow, copper",grey-brown
broadleaf tree,Juglans cinerea,butternut,white walnut,Juglandaceae,WI,"Uncommon forest species found throughout WI. Numbers declining, probably due to Butternut Canker.","Slow-growing short-lived tree to 65 ft with light gray , somewhat striated, bark.  Leaves are alternate, pinnate, 16–28"" (40 - 70 cm) long, with 11–17 leaflets, 2 - 4"" long (5 - 10 cm).  Leaves have an odd number of leaflets with a distinct terminal leaflet at the end of the leafstalk, unlike black walnut.  Leaves are hairy.  Male (staminate) flowers are inconspicuous, yellow-green slender catkins that develop from auxiliary buds and female (pistillate) flowers are short terminal spikes on current year's shoots.  Each female flower has a light pink stigma. The fruit is an oblong nut surrouded by a green, sticky husk, 1 1/4 - 2 1/4"" (3-6 cm) long and 3⁄4–1 1⁄2"" (2 - 4 cm) wide, produced in bunches of two to six together.   Twigs are stout, with distinctive large ""monkey-face"" leaf scars crowned with a fringe of hairs above. The buds covered in a few scales, and the pith very dark brown and chambered (use a knife to slice twig longitudinally).","Nuts are  important for wildlife.  Butternut is rare, so not commercially important, though the wood is of good quality for furniture though softer than black walnut.  A yellow or brown dye can be made from the nut husks and bark.","Alternate, feathery leaves having a terminal leaflet and an oblong walnut-like fruit.  Rare.","Black walnut (J. nigra) has leaves with a highly reduced or absent terminal leaflet.  The nuts of black walnut are spherical, not elongate, and the pith, while also chambered, is a light brown, not very dark brown.",Special concern,,broadleaf,alternate,pinnately compound,,11-17,lanceolate,,"finely toothed, coarsely toothed",pinnate,,,round,,dull,dull,no,no thorns,inconspicuous / petals absent,,,nut,"green, brown, black",fissured,yellow,grey-brown
broadleaf tree,Juglans nigra,black walnut,,Juglandaceae,WI,Shade intolerant tree found in S half of WI.  Common and somewhat weedy in secondary forests.,"Medium to large tree up to 100 ft tall with thick, dark grey, deeply ridged bark.  Leaves alternate, pinnately compound, 12 - 24"" long with 10 - 24 leaflets, sometimes with a poorly formed terminal leaflet.  Leaflets ovate-lanceolate, finely serrate, and 3 - 3 1/2"" long. The leaves have a somewhat rancid disagreeable odor when crushed.  Flowers in catkins; male catkins, 2 1/2 - 5 1/2"" long; females on short spikes near twig end, yellow-green in color.  Fruit a nut in a round leathery husk, 2 - 2 1/2"" in diameter.  The walnut within the husk is rough ridged, with a corrugated, brain-like edible seed inside.  Twigs are stout, light brown, with a light-brown chambered pith; buds are tan, and large with a few pubescent scales; leaf scars are 3-lobed, resembling a ""monkey face"".
Bark: Brown on surface, darker brown when cut, ridged and furrowed with a rough diamond pattern.
Form: A medium to large tree up to 100 feet in height that developes a straight, clear bole with a narrow crown under competition, twigs and branches quite stout.","By wildlife:  Walnuts are important food source for squirrels.  
By humans:  Wood is deep brown in color and excellent for furniture, cabinetry and lumber. It has a high heat content making it excellent as firewood. Nuts are edible.",Long pinnate leaves with aborted terminal leaflet and round nuts.  Light colored chambered pith can confirm ID.,"Butternut is very rare. The leaves have a terminal leaflet, and the chambered pith is very dark brown.",Native,,broadleaf,alternate,pinnately compound,,"11-17, >17",lanceolate,,"finely toothed, coarsely toothed",pinnate,,,round,,"dull, hairy","dull, hairy",no,no thorns,inconspicuous / petals absent,,,nut,"green, brown, black","ridged, fissured",yellow,grey-brown
broadleaf tree,Carya cordiformis,bitter-nut hickory,"yellowbud hickory, pig-nut",Juglandaceae,WI,"Non-dominant forest species in dry, dry-mesic, and mesic forest mostly in S WI.","Medium to tall tree with alternate and pinnately compound leaves having 7-11 leaflets.  The outermost leaflets are larger than the rest.  The twigs are smooth and grey, and the buds are distinctly yellow and naked (not covered by protective bud scales).  The leaflets are toothed, with hairless margins.  The fruit is a round to oval, slightly flattened nut enclosed in a leathery husk with 4 seams.  The nut when opened has two brain-like halves, similar to a pecan or walnut (and in the same Family).  The bark of this tree is medium grey, starting smooth and becoming fissured. ","By wildlife:  The nuts are eaten by wildlife.
By humans: The durable, flexible wood is used for lumber, furniture, paneling, tool handles, and ladders, as well as for pulp.  Like other hickories, the wood is used for smoking meat. The Native Americans used hickory for making bows.","Alternate, pinnately compound leaves and twigs with distinctly yellow buds.","Shagbark hickory has only 5 leaflets, and large, greyish-brown, ovoid buds.
Ashes have opposite, pinnately compound leaves and samara fruits.",Native,,broadleaf,alternate,pinnately compound,,7-11,ovate,,finely toothed,pinnate,,,round,,dull,dull,no,no thorns,inconspicuous / petals absent,,,nut,"green, brown",fissured,yellow,grey-brown
broadleaf tree,Carya ovata,shagbark hickory,shellbark hickory,Juglandaceae,WI,"Found in S half of WI, often with oaks.","Tall, generally straight tree with distinct bark having flat, very shaggy vertical plates.  The leaves are alternate and pinnately compound with 5 (rarely 7) leaflets, the 3 outermost larger and obovate, the 2 closest to the petiole smaller.  Leaflets toothed, with a tiny tuft of hairs on each tooth (use a hand lens!).  The fruit is a round, slightly angled nut enclosed in a leathery husk with 4 seams.  The nut when opened has two brain-like halves, similar to a pecan or walnut (and in the same Family). The twigs are smooth and grey, with very large terminal ovoid buds having several pointed bud scales.","The wood is of high quality for cabinetry and furniture, and is also used for smoking meat. The nuts are tasty and eaten by wildlife and humans.","Alternate, pinnate leaves with 5 leaflets and a large ovoid terminal bud.  Fruit a nut.",Yellowbud hickory (C. cordiformis) has yellow buds and leaves with 7-11 leaflets.,Special concern,,broadleaf,alternate,pinnately compound,,5-7,obovate,,finely toothed,pinnate,,,round,,"dull, hairy","dull, hairy",no,no thorns,inconspicuous / petals absent,,,nut,"green, brown",shaggy,yellow,grey-brown
broadleaf tree,Acer nigrum,black maple,,Sapindaceae,WI,Moist mesic forest,"Black maple was once considered a subspecies of sugar maple, and is very similar in appearance and habitat except that the petioles and leaf undersides are covered with short downy hairs.  The base of the leaf may also be slightly cordate in black maple, and the edges of the leaves droop downward.  The fruit is a paired samara, about 1 - 1 1/2"" long, forming a U shape.",,"Like sugar maple, but with a slightly cordate leaf base and hairs.","Sugar maple has leaves that are not cordate at the base, and lack pubescence.",Native,,broadleaf,opposite,simple,lobed,,,,"pointed lobes, coarsely toothed",palmate,U-shaped,,round,no,"dull, shiny",dull,no,no thorns,inconspicuous / petals absent,,,paired samara,"green, brown","fissured, ridged","orange, yellow",grey-brown
"broadleaf tree, broadleaf shrub",Acer ginnala,Amur maple,,Sapindaceae,Asia,Introduced ornamental,The Amur maple is a small tree with distinctly three-lobed leaves.  ,Ornamental,Three lobed leaf rather narrow with the terminal lobe much longer than the lateral lobes.,Red maple (A. rubrum) has the three lobes of roughly equal size.,Invasive exotic and spreading,,broadleaf,opposite,simple,lobed,,,,"pointed lobes, coarsely toothed",palmate,V-shaped,leaf longer than wide,round,no,"dull, shiny","dull, shiny",no,no thorns,inconspicuous / petals absent,,,paired samara,"green, brown","smooth, striate, fissured","red, yellow-green",grey-brown
broadleaf tree,Acer pensylvanicum,moosewood,"striped maple, goosefoot maple",Sapindaceae,WI,Mixed forests in N WI.,"Small shade tolerant understory tree of mesic northern forests.  Opposite simple leaves with 3 forward-pointing shallow lobes and a quilted surface.  Paired samaras are flared, and hang in long chains. The bark is distinctive, smooth with green and white longitudinal stripes.",Not commercially important.  Planted as an ornamental.,"The bark is unmistakable, having green and white vertical striping.  The three shallow lobes of the leaf point forward, and the leaf has a quilted texture.",,Native,,broadleaf,opposite,simple,lobed,,,,"pointed lobes, coarsely toothed",palmate,V-shaped,leaf as long as wide,round,no,"dull, hairy","dull, hairy",no,no thorns,inconspicuous / petals absent,,,paired samara,"green, brown",striate,"yellow, yellow-green",grey-brown
