broadleaf tree,Morus alba,white mulberry,"Russian mulberry, Chinese mulberry",Moraceae,China,Planted as fruit tree; escapes cultivation in S WI.,"Weedy trees that often have leaning trunks, and highly variable, alternate leaves that are shiny and 3-veined at the base.  The bark is light brown.  On young, vigorous shoots, or in shady areas, the leaves may be up to 30 cm long, ovate or irregularly lobed (often mitten shaped) with rounded sinuses.  In sunny areas, the leaves are smaller, 5–15 cm long, and may be intricately, irregularly lobed. The leaf margin is toothed. Milky sap is present in the petiole during the growing season.  The flowers are single-sex catkins; male catkins are 2–3.5 cm long, and female catkins 1–2 cm long. Male and female flowers are usually on separate trees. The fruit is a 0.5-1"" long aggregate resembling a blackberry that is white or green when unripe, turning red and then black. ","By animals:  Birds and other animals eat the fruits and disperse the seeds.
By humans:  The fruit is edible and made into pies, jams, and wine.  White mulberry, native to China, is the principal food source for the silkworm, from which silk is made.","Shiny, highly variable leaves, often mitten-like or with irregular lobes. Black edible fruit looks like a blackberry.","American mulberry (Morus rubra) has rough leaves, not smooth and shiny.",Invasive,,broadleaf,alternate,simple,"lobed, ovate, cordate",,,,"rounded lobes, coarsely toothed",3-veined,,,round,no,shiny,"dull, shiny",no,no thorns,inconspicuous / petals absent,,,aggregate/multiple,"black, red",fissured,yellow,grey-brown
broadleaf tree,Morus rubra,American mulberry,red mulberry,Moraceae,WI,"Native to northern U.S. in shaded woods, stream banks, ditches, ravines, depressions.  May hybridize with invasive white mulberry (Morus alba).","Tree to 50 ft tall with alternate, simple leaves are 7–14 cm (2 3⁄4 – 5 1⁄2"") long and 6–12 cm (2 1⁄4 – 4 3⁄4"") broad, mostly ovate to cordate in shape (though some leaves may have 2-3 irregular lobes) and with a finely serrated margin.  Milky sap is present in petiole.  Male and female flowers are in catkin-like structures. The fruit is an aggregate, resembling a blackberry, that turns from red to dark purple or black when ripe.  The upper surface of the leaves is notably rough, like fine sandpaper. The underside of the leaves is covered with soft hairs.","By wildlife: Fruits eaten by mammals and birds.  Host tree for Mourning Cloak (Nymphalis antiopa) butterfly larvae.
By humans:  Ripe fruits made into pies, jellies, or jams. Native Americans used the plant for its fibrous inner bark to make cloth, and medicinally as a laxative and emetic, and to treat worms and dysentery. The wood can be used for fenceposts and furniture, or for smoking meat.",,"White mulberry (Morus alba):  Red mulberry has a sandpapery upper leaf surface, not smooth and glossy.",Native,,broadleaf,alternate,simple,"lobed, ovate, cordate",,,,"coarsely toothed, rounded lobes",3-veined,,,round,no,rough,"dull, shiny",no,no thorns,inconspicuous / petals absent,,,aggregate/multiple,"black, red",fissured,yellow,grey-brown
"broadleaf tree, broadleaf shrub",Maclura pomifera,osage-orange,"hedge-apple, horse apple, bois d'arc, bodark, bow-wood, yellow-wood, mock orange",Moraceae,U.S.,"Native to Red River valley of Oklahoma, Arkansas, and Texas. Now widely planted and spreading in old fields, fence rows, farms.","Large shrubs or trees with yellow wood that can reach 60 feet tall, with short trunks and a broad round crown. Leaves are alternate, simple, lanceolate or oblong with long acuminate tips. They are 8-13 cm long and 5-8 cm wide with entire margins, dark green and shiny above, lighter green below.  The twigs are armed with sharp, straight, axillary spines.  The tree is dioecious, meaning female and males trees are separate.  Male flowers are borne on long, drooping racemes.  Each flower has a four-lobed hairy calyx and four stamens arising from a nectar disk.  Female flowers are small and green and clustered into a dense round head, attached to a short stalk and arising from the leaf axils. The flowers have long curved styles covered in fine white hairs.  The mature multiple fruit is a distinctive large (10-13 cm diameter) yellow-green ball, resembling a rough orange.","The live tree is dense and spiny so it can be used as an impenetrable hedge or windbreak.  The wood is hard, heavy, and strong, but flexible.  It is very durable in contact with the ground, so is used for fenceposts.  The wood was used by Native Americans to making bows, and to extract a yellow dye.",,,"Introduced, invasive and spreading",,broadleaf,alternate,simple,"lanceolate, elliptic",,,,entire,pinnate,,,round,no,shiny,"dull, shiny",yes,smooth thorns,inconspicuous / petals absent,,,aggregate/multiple,"green, yellow, orange","ridged, fissured","yellow-green, yellow",grey-brown
broadleaf tree,Platanus occidentalis,sycamore,American plane-tree,Platanaceae,WI,Naturally occurs only in SW WI.,"Large tree with multi-colored bark flaking off like puzzle pieces.  Leaves alternate, large, and palmately lobed.  Lateral bud is hidden within the base of the petiole (gently pull off a leaf to see it).  Flowers in a dense spherical cluster becoming a dangling brown ball, 1 - 1.5"" in diameter, as fruit ripens.  ",,"Multi-colored bark flakes off like puzzle pieces.  Large palmately lobed leaf and fruits in a dangling sphere 1 - 1.5"" across.","The puzzle-piece bark of sycamore makes it pretty unmistakable.  When young the leaves could be confused with maple, but the lateral buds are hidden in the hollow base of the petiole.",,,broadleaf,alternate,simple,lobed,,,,"coarsely toothed, pointed lobes","palmate, 3-veined",,,round,no,"dull, hairy","dull, hairy",no,no thorns,inconspicuous / petals absent,,,aggregate/multiple,"green, brown","flaking, smooth",yellow,multi-color
broadleaf tree,Liriodendron tulipifera,tulip poplar,"tulip tree, yellow poplar",Magnoliaceae,U.S.,"Tuliptree grows in mesic forests in Eastern North America, mostly further south than Wisconsin.  It's range may be spreading due to planting.","A stately tree with a tall, narrow crown and unique, ""tulip-shaped"" leaves with squared-off terminal lobe.  The leaves are alternate and simple.  The flowers are large, having six petals that are mostly green with orange near the base.  The fruit is unique; a collection of many ovaries in the center of the flower that develop into an aggregate of flattened samaras that disperse individually. ",Tulip tree is a popular ornamental due to its fast growth and unique foliage.  ,,,Introduced,,broadleaf,alternate,simple,"truncate, lobed",,,,"entire, pointed lobes",pinnate,,,round,no,dull,dull,no,no thorns,showy / petals present,"green, orange",radial,aggregate/multiple,"green, brown","smooth, fissured",yellow,grey-brown
"broadleaf shrub, broadleaf tree",Amelanchier sanguinea,low serviceberry,"low shadbush, round-leaved serviceberry, round-leaved shadbush",Rosaceae,WI,"Grows in a variety of open or semi-open habitats:  forest edges, meadows or fields, ridges or rocky ledges, shores of rivers or lakes.","A shrub or small tree, sometimes used ornamentally with thin, smooth, grey bark.  Leaves alternate, simple, oblong, elliptic (oval) or ovate and finely toothed with a pointed tip and rounded to slightly cordate base, 1.25 - 2.5' long (30–60 mm). Stipules are present. There usually are scattered woolly hairs on the leaf.  Flowers are actinomorphic (radial symmetry) with narrow white petals, and a hypanthium (cup-like structure) partially enclosing reproductive parts.  There are >10  stamens, and a tuft of hairs on the ovary.  The fruit is a berry-like pome, appearing like a tiny apple, becoming dark purple to black when ripe.",,,,Native,,broadleaf,alternate,simple,"ovate, elliptic",,,,finely toothed,pinnate,,,round,no,dull,dull,no,no thorns,showy / petals present,white,radial,berry,red,smooth,"orange, red, yellow",light grey
"broadleaf tree, broadleaf shrub",Cornus alternifolia,alternate-leaved dogwood,pagoda dogwood,Cornaceae,WI,Understory species found throughout WI.,"Small understory tree to 25' tall, usually less.  Leaves alternate but spirally arranged at the tip of branchlets, simple, and broadly elliptic to round with 5-6 pairs of arcuate secondary veins curving toward the tip of the leaf.  The margins are entire.  The branches are borne horizontally in whorls around the trunk, making an attractive layered branching pattern, hence the name pagoda dogwood.  The bark is smooth and grey.  White flowers are in rounded cymose clusters, 1¼ to 2¾"" across, at the tips of the branches. Each flower has 4 petals and is about 1/4"" wide.  The 1/4 - 3/8"" fruits are blue on red stalks, in upright clusters on the ends of the branches.  The twigs are greenish brown to deep red, with small white diamond-shaped lenticels.",Ornamental.,"Branches in distinct horizontal layers, pagoda-like.  Alternate leaves with arcuate venation. Fruits blue.","All other Cornus have opposite leaves.  The identity as a Cornus can be confirmed with the ""Cornus test"" -- gently pull a leaf apart into two halves, and you will see threadlike fibers connecting the veins of the top half to the bottom half. ",Native,,broadleaf,alternate,simple,"ovate, orbiculate, obovate",,,,entire,arcuate,,,round,no,dull,dull,no,no thorns,showy / petals present,white,radial,berry,blue,smooth,"copper, red",grey-brown
"broadleaf tree, broadleaf shrub",Rhamnus cathartica,common buckthorn,European buckthorn,Rhamnaceae,Europe,"INVASIVE!  Extremely abundant, shade-tolerant invasive exotic in many habitats, especially in southern WI. Often dominates the understory of forests and woodlands.","Shrub with dark green leaves that are sub-opposite (some opposite, some alternate) with arcuate venation.  The bark is smooth and dark grey, becoming cracked and peeling in larger individuals.  The ends of the twigs come to a sharp point.  Clusters of unremarkable flowers emerge from the axils of the leaves and produce clusters of shiny black, round berries.  This shrub is one of the first to leaf out in spring, and the last to drop leaves in fall, thus it effectively shades out native understory plants.","By wildlife:  Birds eat and disperse the seeds.
By humans:  Formerly used as an ornamental, but has become one of the most problematic invasives in WI.",Sub-opposite leaves with arcing veins and shiny black fruits,"Dogwoods (genus Cornus) have consistently opposite leaves with arcuate veins, but blue-black or white fruits are borne in branched inflorescences, not shiny black and clustered at the leaf axils.","Highly invasive exotic, difficult to eradicate",,broadleaf,"alternate, opposite",simple,"ovate, obovate",,,,finely toothed,arcuate,,,round,no,"dull, shiny","dull, shiny",no,no thorns,showy / petals present,"green, yellow",radial,"berry, drupe",black,"smooth, peeling/papery",yellow-green,grey-brown
"broadleaf tree, broadleaf shrub",Alnus glutinosa,European alder,black alder,Betulaceae,Europe,"Planted for streambank cover and stabilization, reclamation.  Association with nitrogen fixing bacterium (Frankia alni) enables it to grow in poor soils.","Tree 40-60 ft tall, often with several trunks and a narrow crown. Leaves alternate, simple, broadly obovate or oval, with doubly serrate margin and a blunt or notched tip.  Leaves coated with somewhat sticky resin on top and bottom.  Male catkins clustered, 1 1/2 - 5"" long and drooping. Female catkins ovoid, become woody and cone-like when ripe in late summer.  Persist on tree through winter.  Fruits a flat, 2-4 mm long winged nutlet borne within the cones (shake out to see). Bark smooth greyish-green turning a speckled grayish-brown with pale, horizontal lenticels.  Winter buds on a 1-2 mm stalk and covered by a single bud scale.","By wildlife:  Seeds provide food and thickets provide shelter for many species in winter.
By humans: Planted as ornamental, flood control, and reclamation species in wet areas.  In Europe, it grows mostly on moist ground near rivers, ponds and lakes, but can also grow in drier locations and mixed woodland edges. Wood resists rot underwater, so the tree is used for underwater pilings.  The bark produces colored tannins used to produce brown and black dyes.  Many medicinal uses have been reported for this tree:  including as an astringent, cathartic, anti-inflammatory, and emetic, as well as for treatment of sore throat, lice, and scabies (bark);  also for breast pain, cancer, and rheumatism (leaves);  antibacterial on E. coli and MRSA (seeds). ",Shrubby tree of wet habitats.  Leaves notched at tip.  Small woody cones bear winged seeds.,"Speckled alder (Alnus incana):  Our native alder is a thicket-forming shrubby tree with leaves that come to an acute tip, not blunt or notched like the European alder. It is much more widespread in wet places in WI than the European species.","Introduced, potentially invasive",,broadleaf,alternate,simple,"orbiculate (round), obovate",,,,doubly toothed,pinnate,,,round,no,dull,dull,no,no thorns,inconspicuous / petals absent,,,catkin/cone,,lenticellate,yellow-green,grey-brown
broadleaf tree,Betula cordifolia,heart-leaf birch,"mountain white birch, mountain paper birch",Betulaceae,WI,"Moist areas, near lakes, on rocky slopes, and rich woods.","Betula cordifolia was once considered a variety of paper birch (B. papyrifera). The tree can reach 75 ft tall and trunk diameters up to 30"", but such large trees are rare.  Mature bark is white or bronze-white, peeling in thin layers. The inner surface of the bark is copper coloured and the young bark is shiny brown with pale brown lenticels. Leaves are alternate, ovate, 3 - 5"" long (6–12 cm) long, and double-toothed. As the species epithet suggests, the leaf base is generally cordate (heart-shaped), however this can be misleading as it is occasionally flat or rounded. The leaves are dotted with many resin glands and the buds are ovoid and blunt. The twigs are yellow-brown to dark-brown and are dotted with resin glands and gray lenticels. They lack the hairs found on Betula papyrifera. The flowers are catkins, with pollen catkins 1-2"" cm long and seed catkins 1/2 - 1"" long. The seed catkins mature to about 3–5 cm long and bear tiny winged nutlets 1/16 - 1/8"" long.",,,"Paper birch (Betula papyrifera):  Heart-leaf birch can be distinguished from paper birch by having leaves dotted with resin glands (use a hand lens) and usually some are cordate (heart-shaped) while paper birch's leaves are mostly ovate.  Young shoots of heart-leaf birch are not hairy, as they are in paper birch. ",Native,,broadleaf,alternate,simple,cordate,,,,doubly toothed,pinnate,,,round,no,"dull, shiny","dull, shiny",no,no thorns,inconspicuous / petals absent,,,catkin/cone,,peeling/papery,yellow,"tan, white, pinkish-white"
broadleaf tree,Betula pumila,"bog birch, dwarf birch, swamp birch",,Betulaceae,WI,"Moist to wet; bogs, calcareous fens, wooded swamps, muskegs, lakeshores","A dense, multistemmed shrub of wet areas, usually 4 - 13' tall, but highly variable in leaf characters and height.  Leaves are simple and alternate, but clustered into 2s or occasionally 3s on short, spur-like shoots, making it difficult to tell the leaves are alternate.  Leaves borne singly on the youngest elongating branches. The leaf is obovate, widest above the middle, 3/4 - 1 1/2"" long, 1/2 - 1"" wide, with coarse rounded or sharp teeth (sometimes doubly toothed) on the margins. The upper surface is dark green, and smooth or with a few scattered hairs and glandular dots, the lower surface similar but lighter green.  Twigs are brown to red-brown or burgundy, with scattered lenticels. New twigs is hairy but becomes hairless by the second year.  Older bark is gray to red-brown with pale lenticels.  Flowers in catkins; male flowers develop in fall as a slender spike tightly enclosed by bud scales, and opening to 3/4 - 1"" pendant catkin in spring.  Female catkins are cylindrical, 1/3 to 3/4"" long, becoming erect, egg-shaped clusters of 1/8 - 1/4"" long winged nutlets. ","By wildife:  Seeds for songbirds, browse for deer, cover for Greater Prairie Chicken in WI.",Multistemmed shrub with doubly toothed margins and catkins in wet areas.,"Yellow birch (Betula alleghaniensis):  All other WI birches are trees, however young yellow birch also growing in wet places can be distinguished from bog birch by having a wintergreen odor in the bark when it is torn from the twig.",Native,,broadleaf,alternate,simple,obovate,,,,doubly toothed,pinnate,,,round,no,"dull, shiny","dull, shiny",no,no thorns,inconspicuous / petals absent,,,catkin/cone,,"smooth, lenticellate","yellow, orange","brown, red, green"
broadleaf tree,Betula alleghaniensis,yellow birch,,Betulaceae,WI,Found throughout WI in wet and mesic forests. More abundant in northern WI.,"Tree to 100' tall, with a straight trunk, and smooth dark-grey silvery or platinum colored bark peeling horizontally into thin strips. The twigs when torn give off a minty wintergreen smell.  The alternate, simple leaves are often borne in pairs on short shoots.  The leaf is ovate to elliptic and often slightly cordate, with a doubly-toothed margin.  The underside of the leaf has hairs.  Flowers are in catkins, the male catkins pendant, the female catkins erect, and the fruits, released in fall, are tiny winged samaras borne within the catkin bracts; the wings narrower than the seed.","By wildlife: Seeds eaten by birds.  Bark foraged upon by yellow-bellied sapsuckers. Shoots browsed by deer and rabbits.
By humans:  Most important species for birch lumber in the U.S. Fine, light colored wood is used for flooring, furniture, doors, veneer, cabinetry and toothpicks.","Silvery, horizontally peeling bark.  Leaves doubly toothed.","Heart-leaf birch (Betula cordilfolia) lacks the wintergreen odor in the twigs, and the bark does not peel in thin horizontal strips.  ",Native,,broadleaf,alternate,simple,ovate,,,,doubly toothed,pinnate,,,round,no,"dull, shiny","dull, shiny",no,no thorns,inconspicuous / petals absent,,,catkin/cone,,peeling/papery,yellow,silvery
broadleaf tree,Betula nigra,river birch,"black birch, red birch",Betulaceae,WI,"Found on flood plains near Mississippi and WI Rivers, in southern and central WI.  Absent from northern part of the state. Commonly planted as ornamental.","Tree to 80' tall, often with several trunks, rounded crown.  Bark yellowish, pinking, or creamy white or grey-brown, peeling into papery sheets; dark, horizontal lenticels; twigs with no wintergreen taste or smell.  Leaves ovate to somewhat deltoid, coarsely doubly toothed with pointed tip, 1 1⁄2–3 1⁄4"" (4-8 cm) long and 1 1⁄4–2 1⁄4"" (3-6 cm) wide.  Flowers on catkins in late spring. Fruits conical to round, erect catkins with scales often remaining into early winter.  Samara wings on tiny seeds narrower than the body and usually widest near the top.","By wildlife:  Seeds eaten by birds. 
By humans:  Boiled sap was used as a sweetener by Native Americans. Essential oils from leaves have demonstrated insecticidal, nematicidal, and antibacterial properties.
 ",,,Native,,broadleaf,alternate,simple,ovate,,,,doubly toothed,pinnate,,,round,no,"dull, shiny","dull, shiny",no,no thorns,inconspicuous / petals absent,,,catkin/cone,,peeling/papery,yellow,"pinkish-white, tan"
broadleaf tree,Betula papyrifera,paper birch,"canoe birch, white birch",Betulaceae,WI,"Shade-intolerant pioneer tree found throughout WI in moist woods, and rocky slopes. Often colonizes recent burns.","Tree to 65' tall, often with several trunks and narrow crowns. Bark distinctly white and peeling in papery sheets, especially on medium sized branches.  Occasionally reddish brown turning reddish white to tan or bronze with age; dark, horizontal lenticels. Leaves narrowly ovate with a short tip and doubly-toothed margin, usually with a cordate base.  Leaves usually somewhat hairy below.  Flowers in catkins usually about 2"" long; blooms in late spring. Fruits in a hanging cylindrical catkin; wings of samara wider than the body of the tiny seeds and widest near the top.","By wildlife:  Birds eat seeds, yellow-bellied sapsuckers favor the trees' sap.  Deer and rabbits browse shoots and leaves.  Moose browse on bark in winter. 
By humans:  Soft but heavy wood of very light color used for paper, pulpwood, firewood, furniture, and flooring.  Bark makes excellent tinder, and Native Americans used it for water-proofing and building canoes.","White bark that peels in papery rolls.  Alternate, doubly toothed leaves.","River birch (Betula nigra) has peeling bark, but it is pinkish or yellowish or bronzy in color.  River birch is restricted to floodplains in southern half of WI.",Native,,broadleaf,alternate,simple,ovate,,,,doubly toothed,pinnate,,,round,no,"dull, shiny","dull, shiny",no,no thorns,inconspicuous / petals absent,,,catkin/cone,,"peeling/papery, lenticellate",yellow,white
"broadleaf tree, broadleaf shrub",Prunus nigra,Canadian plum,,Rosaceae,WI,Not a common tree. Found scattered across WI in woodlands and woodland edges.,"Small tree sometimes suckering from base with alternate, simple leaves 2½ to 4¼"" long and 1½ to 2¾"" wide. Long, dull and rough thorns adorn the branches. The blade is broadly elliptic to obovate-elliptic, often widest above the middle, abruptly tapered to a point on a 1/3 to 2/3"", hairy stalk with a few small glands near the leaf blade. Edges are finely or doubly-toothed, the teeth blunt with a small gland at the tip (use a hand lens). The upper leaf surface is dark green, sparsely hairy, the lower surface is lighter and sparsely to densely hairy, especially along the veins.  Bark is smooth and gray, becoming coarse and peeling on older stems.  Fruit is a purplish or red drupe with a single pit, 1"" in diameter, with a whitish waxy coating.","Fruits made into jellies, jams, pie, and wine.","Small tree with long-tipped ovate-lanceolate leaves, dull thorns, glands on leaf stalk, and large oval drupes (plums).","American Plum (Prunus americana) is very similar, and is a more common tree, found in sunny sites, not in woods. The two species may overlap where forest meets prairie. Canada Plum has broader leaves with blunt, gland-tipped teeth and glands on the leaf stalk, while American Plum has sharply toothed leaves and glands at the base of the leaf. ",Native,,broadleaf,alternate,simple,"obovate, ovate, lanceolate, elliptic",,,,"coarsely toothed, finely toothed",pinnate,,,round,no,dull,"dull, hairy",no,bumpy thorns,showy / petals present,white,radial,drupe,"purple, red","smooth, fissured","red, burgundy",grey-brown
broadleaf tree,Prunus americana,American plum,wild plum,Rosaceae,WI,"Common in southern portion of state in sunny, open habitat.","A shrub or small tree with 2-2 1/2"" dull, bumpy thorns, common in prairies and woodland borders. Has expanded with fire suppression to form dense thickets from root sucker shoots. Leaves are simple, alternate, elliptic to oblong-elliptic, 2 - 4"" long and 1¼ to 1¾"" wide, the tip abruptly tapered to a long point. Upper surface is dark green and mostly hairless, the lower surface is lighter and somewhat hairy. Edges are sharply, often doubly toothed, the teeth without glands. Small glands present at base of leaf near stalk (use hand lens).  The fruit is a purple round to oval drupe with a single stony pit.  Bark starts smooth and grey but becomes dark grey, coarsely fissured and scaly. Young twigs are reddish brown with flaky, waxy coating and hairs.","Fruits made into jellies, jams, pie, and wine.","Small tree with long-tipped ovate-lanceolate leaves, dull thorns, and large oval drupes (plums).","Canadian plum (Prunus nigra) is a woodland species with glands on teeth and on leaf stalk, rather sharp teeth and glands on leaf base.  
Hawthorns (Crataegus spp.) have smooth shiny thorns, not dull bumpy ones.",Native,,broadleaf,alternate,simple,"obovate, ovate, lanceolate, elliptic",,,,"coarsely toothed, finely toothed",pinnate,,,round,no,dull,"dull, hairy",no,bumpy thorns,showy / petals present,white,radial,drupe,purple,"scaly, smooth","orange, yellow, red",grey-brown
"broadleaf tree, broadleaf shrub",Prunus virginiana,chokecherry,eastern chokecherry,Rosaceae,WI,Understory tree found throughout WI.,"Understory shrub with alternate, simple, broadly ovate to elliptic leaves with toothed margins paired glands on petiole.  Bark of larger stems is grey with a darker net-like pattern on it.  The flowers are small, white, and in elongate racemes. The fruit is a drupe, red becoming black when ripe.  ",Little commercial value for humans. ,"Shrub with net-like pattern on bark, and paired glands on leaf petiole. Toothed leaf without rusty hairs on the underside.","Black cherry (Prunus serotina) is a tree with dark grey (almost black) scaly bark, while choke cherry is a shrub with smooth grey bark having a net-like pattern of darker lines on it.  The leaves of choke cherry lack a line of rusty hairs along the midvein beneath.",Native,,broadleaf,alternate,simple,"ovate, elliptic",,,,finely toothed,pinnate,,,round,no,dull,dull,no,no thorns,showy / petals present,white,radial,drupe,black,"smooth, peeling/papery","yellow, orange",grey-brown
